Id,Name,SKU,content,"Short Description",sku,category,"Gallery Image","Product Image",Download,Image,print-position-1,color,kop-fran,tariff-stat-nr,standardfarg,tryckyta,logo,material,vikt,dimensioner,certifikat,"price option 50","price option 100","price option 250","price option 500","price option 1000","price option 2500","price option 5000",order-from,tariff-stat-no,print-surface,weight,dimensions,certificate,capacity,kapacitet,packaging,other,ovrigt,buy-from,standard-colour,imprint-surface,dimension,certificat,version,print-position-2,accessories,dimensionsr,print-area,dimensiones,colour,solar-charger,input,output,solar-laddning,printing-surface,tariff-statno,print-position-3,own-design,farg,sizes
0,"Blue TWS ECO Bass Power",5350-00.001,,"Smidiga trådlösa hörlurar med ett batteri på 200mAh och 30mAh per hörlur. Genom enkel beröring kan du på ett smidigt sätt hantera din musik eller svara på samtal utan att använda telefonen. Hörlurarna har en användningstid på runt 3-4 timmar på endast en laddning. Dessa hörlurar är ett bra val för att njuta av musik och mycket mer oavsett var du befinner dig",5350-00.001,Electronics,"https://elvirainfotech.live/usb/wp-content/uploads/2023/04/5350-00.001-4-scaled.jpg,https://elvirainfotech.live/usb/wp-content/uploads/2023/04/5350-00.001_Front-3-scaled.jpg,https://elvirainfotech.live/usb/wp-content/uploads/2023/04/5350-00.001_1-3-scaled.jpg",https://elvirainfotech.live/usb/wp-content/uploads/2023/04/5350-00.001-4-scaled.jpg,"<a href=""https://www.usb.nu/wp-content/uploads/2023/04/5350-00.00-Pics.zip"">5350-00.00-Pics</a>",,715-sv,"black-2,blue-2,green-2,red-2,yellow-2",50st,"85183000 900",Svart,30x15,Screen,ABS,30g,55x47x29mm,"Rohs, EMC",100,250,,,2500,,,-,-,-,-,-,-,-,-,-,-,-,-,-,-,-,-,-,-,-,-,-,-,-,-,-,-,-,-,-,-,-,-,-
1,"Blue TWS ECO Bass Power",5350-00.001,,"Wireless headphones with a 200mAh battery and 30mAh per earbud deliver an exceptional audio experience without compromising battery life. Featuring touch-based voice control, you can effortlessly manage your music playback or answer calls hands-free. These headphones combine practicality and innovation to offer a seamless and wireless listening experience. With fast charging capability and long-lasting usage, these headphones are perfect for enjoying music, podcasts, and more, wherever you go.",5350-00.001,"Electronics,Touch","https://elvirainfotech.live/usb/wp-content/uploads/2023/04/5350-00.001-4-scaled.jpg,https://elvirainfotech.live/usb/wp-content/uploads/2023/04/5350-00.001_Front-3-scaled.jpg,https://elvirainfotech.live/usb/wp-content/uploads/2023/04/5350-00.001_1-3-scaled.jpg",https://elvirainfotech.live/usb/wp-content/uploads/2023/04/5350-00.001-4-scaled.jpg,"<a href=""https://www.usb.nu/wp-content/uploads/2023/04/5350-00.00-Pics.zip"">5350-00.00-Pics</a>",,715,Black,-,-,-,-,Screen,ABS,-,-,-,100,250,99,93,88,85,81,50pcs,"85183000 900",30x15,30g,55x47x29mm,"Rohs,EMC",-,-,-,-,-,-,-,-,-,-,-,-,-,-,-,-,-,-,-,-,-,-,-,-,-,-,-
2,"LED MegaBeam WorkLight Maxi COB",605-00.012,,"Large aluminum work light with Eco-Watt LED headlight and COB work light. COB technology, protected against splashing water and over voltage protected.",605-00.012,"Accessories,News",,https://elvirainfotech.live/usb/wp-content/uploads/2022/12/605-00.012_LED-Megabeam-WorklightMaxiCOB_1.jpg,,,725,Titan,-,-,-,-,Laserengraving,Aluminium,-,-,-,99,69,64,59,57,55,53,"100 pcs",85131000000,60x10mm,83g,172x20x20mm,"Rohs, EMC","3 AAA batteries",-,-,-,-,-,-,-,-,-,-,-,-,-,-,-,-,-,-,-,-,-,-,-,-,-,-
3,"LED MegaBeam WorkLight Maxi COB",605-00.012,,"Stor arbetslampa i aluminium med Eco-Watt LED-strålkastare och COB-arbetslampa. COB-teknik, vattensäker och inbyggt överspänningsskydd.",605-00.012,"Nyheter,Övrigt",,https://elvirainfotech.live/usb/wp-content/uploads/2022/12/605-00.012_LED-Megabeam-WorklightMaxiCOB_1.jpg,,,725-sv,-,"100 st",85131000000,Titan,60x10mm,Lasergravyr,Aluminium,83g,172x20x20mm,"Rohs, EMC",99,69,64,59,57,55,53,-,-,-,-,-,-,-,"3 AAA Batterier",-,-,-,-,-,-,-,-,-,-,-,-,-,-,-,-,-,-,-,-,-,-,-,-,-
4,"LED Megabeam Light Tech Pen (warm white light)",883-00.W08,,"Lightweight flashlight with a focused LED and warm white light that ensures true color representation. Also for medical diagnostic purposes.",883-00.W08,"Accessories,News",,https://elvirainfotech.live/usb/wp-content/uploads/2022/12/883-00.W08_LED-Megabeam-Light-TechPen-Silver-WarmWhite_1.jpg,,,725,Silver,-,-,-,-,"Laser engraving",Metal,-,-,-,72,39,36,34,32,30,29,"XXX pcs",85131000000,30x6mm,83g,111x14x14mm,"Rohs, EMC","1AAA battery",-,-,-,-,-,-,-,-,-,-,-,-,-,-,-,-,-,-,-,-,-,-,-,-,-,-
5,"LED Megabeam Light Tech Pen (warm white light)",883-00.W08,,"Lätt ficklampa med fokuserad LED och varmvitt ljus som säkerställer sann färgrepresentation. Även för medicinska diagnostiska ändamål.",883-00.W08,"Nyheter,Övrigt",,https://elvirainfotech.live/usb/wp-content/uploads/2022/12/883-00.W08_LED-Megabeam-Light-TechPen-Silver-WarmWhite_1.jpg,,,725-sv,-,"100 st",85131000000,Silver,30x6mm,Lasergravyr,Metall,83g,111x14x14mm,"Rohs,EMC",72,39,36,34,32,30,29,-,-,-,-,-,-,-,"1AAA batteri",-,-,-,-,-,-,-,-,-,-,-,-,-,-,-,-,-,-,-,-,-,-,-,-,-
6,"LED MegaBeam WorkLight Midi COB",610-00.012,,"Medium-sized aluminum work light with Eco-Watt LED headlight and COB work light. Built in magnetic base and with COB technology, protected against splashing water and over voltage.",610-00.012,"Accessories,News","https://elvirainfotech.live/usb/wp-content/uploads/2022/12/spr-610-00-012_metmaxx_led_megabeam_worklight_worklightmidicob_titan_2.jpg,https://elvirainfotech.live/usb/wp-content/uploads/2022/12/spr-610-00-012_metmaxx_led_megabeam_worklight_worklightmidicob_titan_1.jpg,https://elvirainfotech.live/usb/wp-content/uploads/2022/12/610-00.012_front.jpg",https://elvirainfotech.live/usb/wp-content/uploads/2022/12/spr-610-00-012_metmaxx_led_megabeam_worklight_worklightmidicob_titan_1.jpg,,,725,Titan,-,-,-,-,"Laser engraving",Aluminium,-,-,-,96,69,65,59,57,54,52,"100 pcs",85131000000,40x8mm,33g,126x16x16mm,"Rohs,EMC",-,-,-,-,-,-,-,-,-,-,-,-,-,-,-,-,-,-,-,-,-,-,-,-,-,-,-
7,"LED MegaBeam WorkLight Midi COB",610-00.012,,"Mellanstor arbetslampa i aluminium med Eco-Watt LED-strålkastare och COB-arbetslampa. Inbyggd magnetisk bas och med COB-teknik, skyddad mot vattenstänk och överspänning.",610-00.012,"Nyheter,Övrigt","https://elvirainfotech.live/usb/wp-content/uploads/2022/12/spr-610-00-012_metmaxx_led_megabeam_worklight_worklightmidicob_titan_2.jpg,https://elvirainfotech.live/usb/wp-content/uploads/2022/12/spr-610-00-012_metmaxx_led_megabeam_worklight_worklightmidicob_titan_1.jpg,https://elvirainfotech.live/usb/wp-content/uploads/2022/12/610-00.012_front.jpg",https://elvirainfotech.live/usb/wp-content/uploads/2022/12/spr-610-00-012_metmaxx_led_megabeam_worklight_worklightmidicob_titan_1.jpg,,,725-sv,-,"100 st",85131000000,Titan,40x8mm,Lasergravyr,Aluminium,33g,126x16x16mm,"Rohs,EMC",96,69,65,59,57,54,52,-,-,-,-,-,-,-,"1AAA batteri",-,-,-,-,-,-,-,-,-,-,-,-,-,-,-,-,-,-,-,-,-,-,-,-,-
8,"PD Fast charging wall adapter Set  20W +3A cable",16630,,"The charger SET of the future with USB C PD charging and QC 3.0 fast charging is here. The 2in1 cable gives a power of over 20W output. USB-C PD charging is a fast-charging feature that charges your iPhone 8 or newer mobile phones extremely fast. Charge of as much as 50 percent in 30 minutes for a mobile phone and an iPad Pro to 50 percent in 60 minutes. This is when connected to the  USB-C to Lightning cable that is included in this gift set. With the right wall contact as our PD Fast Charging wall adapter together with the right USB Type C cable, you have a wall contact that is guaranteed to solve your power problems quickly. The charging time varies depending on environmental factors. The connector is TUV-approved, guarantees a safe product that is approved in the EU. Delivered<span class=""Y2IQFc"" lang=""en""> in a nice black box.</span>",16630,"Chargers/Cables,News","https://elvirainfotech.live/usb/wp-content/uploads/2022/12/16630-PD-plug-and-cable-in-BLACK_3.jpg,https://elvirainfotech.live/usb/wp-content/uploads/2023/01/16630_PD-Fast-charging-Set-cable-white_9.jpg,https://elvirainfotech.live/usb/wp-content/uploads/2023/01/4.jpg,https://elvirainfotech.live/usb/wp-content/uploads/2023/01/8.jpg,https://elvirainfotech.live/usb/wp-content/uploads/2023/01/16.jpg,https://elvirainfotech.live/usb/wp-content/uploads/2023/01/19.jpg,https://elvirainfotech.live/usb/wp-content/uploads/2023/01/27.jpg,https://elvirainfotech.live/usb/wp-content/uploads/2022/12/16630-PD-plug-and-cable-in-BLACK_1.jpg",https://elvirainfotech.live/usb/wp-content/uploads/2022/12/16630-PD-plug-and-cable-in-BLACK_1.jpg,"<a href=""https://www.usb.nu/wp-content/uploads/2023/01/16630_PD-Fast-charging-Set-cable-PIC.zip"" target=""_blank"" rel=""noopener"">16630_PD Fast charging Set cable PIC</a>

<a href=""https://www.usb.nu/wp-content/uploads/2023/01/16630_14110_PD-Fast-Charging-wall-adapter-SET_SIM-1.pdf"" target=""_blank"" rel=""noopener"">16630_14110_PD Fast Charging wall adapter SET_SIM</a>

<a href=""https://www.usb.nu/wp-content/uploads/2023/01/14110-Declaration-of-Conformity.pdf"" target=""_blank"" rel=""noopener"">14110 Declaration of Conformity</a>",,"715,203-11m,211-11-3m,211-11-4m,214-14m","Black or white product",-,-,-,-,Screen,ABS,-,-,-,139,128,116,109,104,99,89,"100 pcs",8507600065,25x25mm,100g,"104x72x38mm (black box)","Rohs,EMC and TUV",20W,-,735,-,-,-,-,-,-,-,-,-,-,-,-,-,-,-,-,-,-,-,-,-,-,-,-
9,"PD Fast charging wall adapter Set  20W +3A cable",16630,,"Framtidens laddset med USB C PD charging och QC 3,0 fast charge är här. Denna 2i1 laddkablen ger en output på över 20W. USB-C PD laddning är en snabb laddningsfunktion som laddar din iPad eller från iPhone 8 eller nyare extremt snabbt. Laddning om hela 50 procent på 30 minuter för en mobiltelefon och en iPad Pro till 50 procent på 60 minuter. Detta när den är ihopkopplad med den tillhörande USB-C till Lightning-kabel.  Med rätt väggkontakt som vår PD Fast Charging wall adapter tillsammans med vår sladd USB Type C så har du en väggkontakt som garanterat löser dina strömproblem snabbt. Laddningstiden varierar beroende på miljöfaktorer. Kontakten är TUV approved vilket garanterar en säker produkt som är gdk i EU. Kommer i fin svart ask.",16630,"Laddare/Sladdar,Nyheter","https://elvirainfotech.live/usb/wp-content/uploads/2022/12/16630-PD-plug-and-cable-in-BLACK_3.jpg,https://elvirainfotech.live/usb/wp-content/uploads/2023/01/16630_PD-Fast-charging-Set-cable-white_9.jpg,https://elvirainfotech.live/usb/wp-content/uploads/2023/01/4.jpg,https://elvirainfotech.live/usb/wp-content/uploads/2023/01/8.jpg,https://elvirainfotech.live/usb/wp-content/uploads/2023/01/16.jpg,https://elvirainfotech.live/usb/wp-content/uploads/2023/01/19.jpg,https://elvirainfotech.live/usb/wp-content/uploads/2023/01/27.jpg,https://elvirainfotech.live/usb/wp-content/uploads/2022/12/16630-PD-plug-and-cable-in-BLACK_1.jpg",https://elvirainfotech.live/usb/wp-content/uploads/2022/12/16630-PD-plug-and-cable-in-BLACK_1.jpg,"<a href=""https://www.usb.nu/wp-content/uploads/2023/01/16630_PD-Fast-charging-Set-cable-PIC.zip"" target=""_blank"" rel=""noopener"">16630_PD Fast charging Set cable PIC</a>

<a href=""https://www.usb.nu/wp-content/uploads/2023/01/16630_14110_PD-Fast-Charging-wall-adapter-SET_SIM-1.pdf"" target=""_blank"" rel=""noopener"">16630_14110_PD Fast Charging wall adapter SET_SIM</a>

<a href=""https://www.usb.nu/wp-content/uploads/2023/01/14110-Declaration-of-Conformity.pdf"" target=""_blank"" rel=""noopener"">14110 Declaration of Conformity</a>",,"715-sv,203-11m-sv,211-11-3m-sv,211-11-4m-sv,214-14m-sv",-,"100 st",85076000065,"Svart eller vit produkt",25x25mm,Screen,ABS,100g,"104x74x38mm (svart box)","Rohs,EMC,TUV",139,128,116,109,104,99,89,-,-,-,-,-,-,-,20W,735-sv,-,-,-,-,-,-,-,-,-,-,-,-,-,-,-,-,-,-,-,-,-,-,-,-
10,"LED MegaBeam HeadLight Swipe",625-00.001,,"Rechargeable high-tech headlight with 120 lumens/3 watt chip-LED light and 350 lumens/5 watts COB lightband- ideal to keep your hands free to work, Innovative swiped movement sensor. COB and LED 2 light modes 100%, 50% and flashing function. (Worktime: at 100% minimum 3h COB, 4H LED and at 50% up to 6.5 hours). Security through a signal reflector strap on the back. ecofriendly through 1200 mAh lithium polymer battery  and 2 light modes + flashing LED had 120 lumens COB on the band 350 lumens  plus motion sensor activated chip. And  reflector band for visibility at night.",625-00.001,"Accessories,News",,https://elvirainfotech.live/usb/wp-content/uploads/2022/12/625-00.001_LED-MegaBeam-Headlight-Swipe_1.jpg,"<a href=""https://www.usb.nu/wp-content/uploads/2023/01/625-00-001_LED-MegaBeam-HeadLight-Swipe_SIM.pdf"" target=""_blank"" rel=""noopener"">625-00-001_LED MegaBeam HeadLight Swipe_SIM</a>",,715,Black/yellow/silver,-,-,-,-,Screen,Silicone/plastic,-,-,-,119,85,82,78,75,72,69,"100 pcs",85131000000,"15x10mm on light, 30x15mm on buckle",69g,290x32x18mm,"Rohs,EMC",-,-,-,-,-,-,-,-,-,-,-,-,-,-,-,-,-,-,-,-,-,-,-,-,-,-,-
11,"LED MegaBeam HeadLight Swipe",625-00.001,,"Uppladdningsbar högteknologisk pannlampa med 120 lumen/3 watt chip-LED-ljus och 350 lumen/5 watt COB-ljusband - perfekt för att hålla händerna fria för att arbeta, Innovativ svepande rörelsesensor tänder och släcker ljuset med en enkel handrörelse. COB och LED lamporna har 2 ljuslägen 100%, 50% och blinkande funktion.   Extra säkerhet genom en reflexrem som är fastsydd på baksidan av pannbandet. Miljövänlig genom ett uppladdningsbart 1200 mAh litiumpolymerbatteri .",625-00.001,"Nyheter,Övrigt",,https://elvirainfotech.live/usb/wp-content/uploads/2022/12/625-00.001_LED-MegaBeam-Headlight-Swipe_1.jpg,"<a href=""https://www.usb.nu/wp-content/uploads/2023/01/625-00-001_LED-MegaBeam-HeadLight-Swipe_SIM.pdf"" target=""_blank"" rel=""noopener"">625-00-001_LED MegaBeam HeadLight Swipe_SIM</a>",,715-sv,-,"100 st",85131000000,Svart/gul/silver,"15x10mm på lampa, 30x15mm på spänne",Screen,Silikon/plast,69g,290x32x18mm,"Rohs,EMC",119,85,82,78,75,72,69,-,-,-,-,-,-,-,-,-,-,-,-,-,-,-,-,-,-,-,-,-,-,-,-,-,-,-,-,-,-,-,-,-
12,"Worklight Recharge Tech",522-00.001,,"The perfect worklight - environmentally friendly rechargeable (top capacity 600 mAh , ultra-compact, foldable, magnetic and clipablewith combined LED high beam and COB work light illumination. (incl. red warning light for loading and unloading/repairs on the road), easy-to-grip plastic with aluminum advertising medium. 120 lumens and including charging cable.",522-00.001,"Accessories,News","https://elvirainfotech.live/usb/wp-content/uploads/2022/12/522-00.001_LED-MegaBeam-Worklight-Recharge-Tech_1.jpg,https://elvirainfotech.live/usb/wp-content/uploads/2022/12/522-00.001_LED-MegaBeam-Worklight-Recharge-Tech_2.jpg,https://elvirainfotech.live/usb/wp-content/uploads/2022/12/522-00.001_LED-MegaBeam-Worklight-Recharge-Tech_4.jpg",https://elvirainfotech.live/usb/wp-content/uploads/2022/12/522-00.001_LED-MegaBeam-Worklight-Recharge-Tech_3.jpg,,,725,Black,-,-,-,-,"Laser engraving",Metal/plastic,-,-,-,119,85,79,75,72,69,67,"100 pcs",85131000000,60x15mm,60g,45x110x25mm,"Rohs, EMC",600mAh,-,-,-,-,-,-,-,-,-,-,-,-,-,-,-,-,-,-,-,-,-,-,-,-,-,-
13,"Worklight Recharge Tech",522-00.001,,"Den perfekta arbetslampan - miljövänlig och uppladdningsbar kapacitet på hela 600 mAh ultrakompakt, hopfällbar, magnetisk och klämbar med kombinerat LED helljus och COB arbetsljusbelysning. (inkl. röd varningslampa för lastning och lossning/reparationer på vägen), lättgreppad yta och ficklampan i aluminium. Hela 120 lumen i ljusstyrka.",522-00.001,"Nyheter,Övrigt","https://elvirainfotech.live/usb/wp-content/uploads/2022/12/522-00.001_LED-MegaBeam-Worklight-Recharge-Tech_1.jpg,https://elvirainfotech.live/usb/wp-content/uploads/2022/12/522-00.001_LED-MegaBeam-Worklight-Recharge-Tech_2.jpg,https://elvirainfotech.live/usb/wp-content/uploads/2022/12/522-00.001_LED-MegaBeam-Worklight-Recharge-Tech_4.jpg",https://elvirainfotech.live/usb/wp-content/uploads/2022/12/522-00.001_LED-MegaBeam-Worklight-Recharge-Tech_3.jpg,,,725-sv,-,"100 st",85131000000,Svart,60x15mm,Lasergravyr,Aluminium,60g,45x110x25mm,"Rohs,EMC",119,85,79,75,72,69,67,-,-,-,-,-,-,-,600mAh,-,-,-,-,-,-,-,-,-,-,-,-,-,-,-,-,-,-,-,-,-,-,-,-,-
14,"LED MegaBeam Light Mini Square ReCharge",600-00.001,,"Innovative rechargeable 500mAh, aluminum ""key fob"" worklight with super bright 500 lumen COB light. 3 light modes 100%, 70% and strobe light. Environmentally friendly without disposable batteries, but rechargeable with a lithium polymer battery - multi-use: home working, breakdown, sport, household, everyday life thanks to a wide range of attachment options using a carbine on a key ring/bag or using a magnet or using the integrated setup mechanism or using a 6 mm thread on a tripod/selfie stick. Cap lifter is also on board. 2 light modes + flashing, COB 500 lumens light duration 3.0h at 100%.",600-00.001,"Accessories,News",,https://elvirainfotech.live/usb/wp-content/uploads/2022/12/600-00.001_LED-MegaBeam-Light-Mini-Square-Light-ReCharge_1.jpg,,,715,Black,-,-,-,-,Screen,Plastic/Aluminium,-,-,-,118,86,79,77,73,69,67,"100 pcs",85131000000,30x8mm,43g,46x60x20mm,"Rohs,EMC",500mAh,-,-,-,-,-,-,-,-,-,-,-,-,-,-,-,-,-,-,-,-,-,-,-,-,-,-
15,"LED MegaBeam Light Mini Square ReCharge",600-00.001,,"Innovativ uppladdningsbar 500mAh ""nyckelbricks""-arbetslampa i aluminium med superstarkt 500 lumen COB-ljus. 3 ljuslägen 100%, 70% och blixtljus. Miljövänlig utan engångsbatterier,  uppladdningsbar med ett litiumpolymerbatteri - Kan användas på många områden som vid hemarbete,  sport aktivitet,  i hemmet, i bilen. Tack vare ett brett utbud av fästalternativ med en karbinhake på en nyckelring eller med hjälp av  magneten eller att ha den stående med hjälp av clipset Även ölöppnare är inbyggd. Lystid vid 100% effekt är 3 timmar",600-00.001,"Nyheter,Övrigt",,https://elvirainfotech.live/usb/wp-content/uploads/2022/12/600-00.001_LED-MegaBeam-Light-Mini-Square-Light-ReCharge_1.jpg,,,715-sv,-,"100 st",85131000000,Svart,30x8mm,Screen,Plast/aluminium,43g,46x60x20mm,"Rohs,EMC",118,86,79,77,73,69,67,-,-,-,-,-,-,-,500mAh,-,-,-,-,-,-,-,-,-,-,-,-,-,-,-,-,-,-,-,-,-,-,-,-,-
16,"LED MegaBeam Security COB",618-00.001,,"Super combination for the car: powerful flood worklight with many safety features. Emergency hammer, belt cutter, magnet holder to place on the roof of the car or above the wheel when you need to change the tyre.",618-00.001,"Accessories,News","https://elvirainfotech.live/usb/wp-content/uploads/2022/12/618-00.001_LED-MegaBeam-Security-COB_4.jpg,https://elvirainfotech.live/usb/wp-content/uploads/2022/12/618-00.001_LED-MegaBeam-Security-COB_5.jpg,https://elvirainfotech.live/usb/wp-content/uploads/2022/12/618-00.001_LED-MegaBeam-Security-COB_6.jpg,https://elvirainfotech.live/usb/wp-content/uploads/2022/12/618-00.001_LED-MegaBeam-Security-COB_2.jpg,https://elvirainfotech.live/usb/wp-content/uploads/2022/12/618-00.001_LED-MegaBeam-Security-COB_3.jpg,https://elvirainfotech.live/usb/wp-content/uploads/2022/12/618-00.001_LED-MegaBeam-Security-COB_7.jpg",https://elvirainfotech.live/usb/wp-content/uploads/2022/12/618-00.001_LED-MegaBeam-Security-COB_1.jpg,"<a href=""https://www.usb.nu/wp-content/uploads/2023/01/618-00.001_LED-MegaBeam-Security-COB_PIC.zip"" target=""_blank"" rel=""noopener"">618-00.001_LED MegaBeam Security COB_PIC</a>

<a href=""https://www.usb.nu/wp-content/uploads/2023/01/618-00-001_LED-MegaBeam-Security-COB_SIM-1.pdf"" target=""_blank"" rel=""noopener"">618-00-001_LED MegaBeam Security COB_SIM</a>",,725,Black,-,-,-,-,"Laser engraving or Tampo",Metal,-,-,-,99,71,66,63,59,57,55,"1000 pcs",85131000000,40x10mm,65g,150x22mm,"Rohs,EMC",-,-,-,-,-,-,-,-,-,-,-,-,-,-,-,-,-,-,-,-,-,-,-,-,-,-,-
17,"LED Megabeam Light Tech Pen",883-00.012,,"Lightweight flashlight with a white bright, focused LED and wide clip for easy carriage on your jacket or shirt. Protected against splash water and built in over-voltage protection.",883-00.012,"Accessories,News",,https://elvirainfotech.live/usb/wp-content/uploads/2022/12/883-00.012_LED-Megabeam-Light-TechPen-Titan_1.jpg,,,725,Titan,-,-,-,-,Laserengraving,Metal,-,-,-,72,42,38,36,34,32,31,"100 pcs",85131000000,30x6mm,38g,111x14x14,"Rohs, EMC","1 AAA battery",-,-,-,-,-,-,-,-,-,-,-,-,-,-,-,-,-,-,-,-,-,-,-,-,-,-
18,"LED Megabeam Light Tech Pen",883-00.012,,"Ficklampa med en fokuserad LED med vitt ljus och en bred klämma för att fästa den i jackan eller tröjan. Stänksäker och med inbyggt överspänningsskydd.",883-00.012,"Nyheter,Övrigt",,https://elvirainfotech.live/usb/wp-content/uploads/2022/12/883-00.012_LED-Megabeam-Light-TechPen-Titan_1.jpg,,,725-sv,-,"100 st",85131000000,Titan,30x6mm,Lasergravyr,Metall,38g,111x14x14mm,"Rohs,EMC",72,42,38,36,34,32,31,-,-,-,-,-,-,-,"1 AAA batteri",-,-,-,-,-,-,-,-,-,-,-,-,-,-,-,-,-,-,-,-,-,-,-,-,-
19,"LED MegaBeam Security COB",618-00.001,,"Superkombination för bilen: kraftfull arbetsstrålkastare med många säkerhetsfunktioner. Nödhammare, bältesklippare, magnethållare att placera på bilens tak eller ovanför hjulet när du behöver byta däck.",618-00.001,"Nyheter,Övrigt","https://elvirainfotech.live/usb/wp-content/uploads/2022/12/618-00.001_LED-MegaBeam-Security-COB_4.jpg,https://elvirainfotech.live/usb/wp-content/uploads/2022/12/618-00.001_LED-MegaBeam-Security-COB_5.jpg,https://elvirainfotech.live/usb/wp-content/uploads/2022/12/618-00.001_LED-MegaBeam-Security-COB_6.jpg,https://elvirainfotech.live/usb/wp-content/uploads/2022/12/618-00.001_LED-MegaBeam-Security-COB_2.jpg,https://elvirainfotech.live/usb/wp-content/uploads/2022/12/618-00.001_LED-MegaBeam-Security-COB_3.jpg,https://elvirainfotech.live/usb/wp-content/uploads/2022/12/618-00.001_LED-MegaBeam-Security-COB_7.jpg",https://elvirainfotech.live/usb/wp-content/uploads/2022/12/618-00.001_LED-MegaBeam-Security-COB_1.jpg,"<a href=""https://www.usb.nu/wp-content/uploads/2023/01/618-00.001_LED-MegaBeam-Security-COB_PIC.zip"" target=""_blank"" rel=""noopener"">618-00.001_LED MegaBeam Security COB_PIC</a>

<a href=""https://www.usb.nu/wp-content/uploads/2023/01/618-00-001_LED-MegaBeam-Security-COB_SIM-1.pdf"" target=""_blank"" rel=""noopener"">618-00-001_LED MegaBeam Security COB_SIM</a>",,725-sv,-,"100 st",85131000000,Svart,40x10mm,"Lasergravyr eller Tampo",Metall,65g,150x22mm,"Rohs, EMC",99,71,66,63,59,57,55,-,-,-,-,-,-,-,-,-,-,-,-,-,-,-,-,-,-,-,-,-,-,-,-,-,-,-,-,-,-,-,-,-
20,"Fitness Tracker Smart Eco",885-00.000,,"Best Buy fitness tracker with top functionality (health heart rate, blood oxygen, blood pressure), sports functions (4 sports), call, message display and much more - sporty IP5, splash-proof, easily rechargeable (45 minutes, average operating time 5 days) high-quality lithium-polymer battery, IPX 6/7, usage 5 days standby 10 days.",885-00.000,"Accessories,News",https://elvirainfotech.live/usb/wp-content/uploads/2022/12/885-00.000_Fitnesstracker-SmartEco_1.jpg,https://elvirainfotech.live/usb/wp-content/uploads/2022/12/885-00.000_Fitnesstracker-SmartEco_1.jpg,,,"715,211-11m",Black,-,-,-,-,Screen,Metal,-,-,-,185,148,141,135,129,124,119,"100 pcs","91021200 000",20x2mm,26g,230x35x12mm,"Rohs, EMC",-,-,-,-,-,-,-,-,-,-,-,-,-,-,-,-,-,-,-,-,-,-,-,-,-,-,-
21,"Fitness Tracker Smart Eco",885-00.000,,"Smart ECO fitnesstracker med toppfunktionalitet (hälsopuls, blodsyre, blodtryck), sportfunktioner (4 sporter), samtal, meddelandedisplay och mycket mer - sportig IPX67 vattensäker snabbladdningsbar (45 minuter, genomsnittlig drifttid) 5 dagar) högkvalitativt litiumpolymerbatteri, IPX 67 med hela 10 dagars standby.",885-00.000,"Nyheter,Övrigt",https://elvirainfotech.live/usb/wp-content/uploads/2022/12/885-00.000_Fitnesstracker-SmartEco_1.jpg,https://elvirainfotech.live/usb/wp-content/uploads/2022/12/885-00.000_Fitnesstracker-SmartEco_1.jpg,,,"715-sv,211-11m-sv",-,"100 st","91021200 000",Black,20x2mm,Screen,Metall,26g,230x35x12mm,"Rohs, EMC",185,148,141,135,129,124,119,-,-,-,-,-,-,-,-,-,-,-,-,-,-,-,-,-,-,-,-,-,-,-,-,-,-,-,-,-,-,-,-,-
22,"LED MegaBeam Flashlight 3W",693-00.003,,"High-performance LED flashlight in an aluminum body, extremely economical and bright light. The 3W LED light is protected against  water splash and over voltage protection circut.",693-00.003,"Accessories,News","https://elvirainfotech.live/usb/wp-content/uploads/2022/12/LED-MegaBeam-Flashlight_693-00.003_1red.jpg,https://elvirainfotech.live/usb/wp-content/uploads/2022/12/LED-MegaBeam-Flashlight_693-00.003_2blue.jpg,https://elvirainfotech.live/usb/wp-content/uploads/2022/12/LED-MegaBeam-Flashlight_693-00.003_5.jpg",https://elvirainfotech.live/usb/wp-content/uploads/2022/12/LED-MegaBeam-Flashlight_693-00.003_4.jpg,,,725,"Blue, red",-,-,-,-,Laserengraving,Metal,-,-,-,88,59,57,53,49,46,42,"100 pcs","85131000 000",25x8mm,83g,27x27x100mm,"Rohs, EMC",3W,-,-,-,-,-,-,-,-,-,-,-,-,-,-,-,-,-,-,-,-,-,-,-,-,-,-
23,"LED MegaBeam Flashlight 3W",693-00.003,,"Högpresterande LED-ficklampa i aluminium, extremt ekonomisk och ljusstark. En 3Watt LED-lampa som ger ett starkt sken. Ficklampan är skyddad mot regn och har överspännings skydd för bästa säkerhet.",693-00.003,"Nyheter,Övrigt","https://elvirainfotech.live/usb/wp-content/uploads/2022/12/LED-MegaBeam-Flashlight_693-00.003_1red.jpg,https://elvirainfotech.live/usb/wp-content/uploads/2022/12/LED-MegaBeam-Flashlight_693-00.003_2blue.jpg,https://elvirainfotech.live/usb/wp-content/uploads/2022/12/LED-MegaBeam-Flashlight_693-00.003_5.jpg",https://elvirainfotech.live/usb/wp-content/uploads/2022/12/LED-MegaBeam-Flashlight_693-00.003_4.jpg,,,725-sv,-,"100 st",85131000000,"Blå, röd",25x8mm,Lasergravyr,Metall,83g,27x27x100mm,"Rohs, EMC",88,59,57,53,49,46,42,-,-,-,-,-,-,-,3W,-,-,-,-,-,-,-,-,-,-,-,-,-,-,-,-,-,-,-,-,-,-,-,-,-
